recommendation,problem_addressed,likely_impact,difficulty,suggested_owner
"Replace the templated 'sorry, email CustomerCare' reply with case-specific public replies that state the actual resolution",0.6% personalization; reviewers mock the boilerplate; replies amplify rather than contain damage,High (public-record trust signal at point of prospect decision),Medium,Head of Customer Care / CX
Stand up a billing/refund + chargeback rapid-resolution path with published policy,billing_refund (93% neg) + scam/fraud language up ~4x; chargeback/processor risk,High (cuts the most trust-corrosive theme and dispute risk),Medium,VP Operations / Finance
"Fix the access-window mechanic: warn before expiry, allow low-friction reactivation",access_expiration up ~2.4x; '60 days then pay again' grievance,"Medium-High (specific, fixable, direct trust upside)",Low-Medium,Product
"Diagnose the H2-2025 reply-ops slowdown (lag 1-3d -> 12-20d, coverage -> 57%)",Newest operational break; the one channel that worked is failing,Medium (prevents further reputational drift),Low (diagnosis); Medium (staffing fix),CX Operations
Root-cause the late-2024 second step-down (Oct-2024..Jan-2025 ~47% neg),"Deepest deterioration is mid/late-2024, beyond the initial early-2024 trigger",High (addresses the real worst-period driver),Medium,Exec sponsor / Ops
"Harden exam/test platform reliability (session persistence, autosave, graceful recovery)","Chronic glitch complaints, 75% at 1-2 star, high effort-loss",Medium (removes a standing 1-star generator),Medium-High,Engineering
Commission a review-integrity + funnel audit (do NOT assert padding publicly),Thin generic 5-star base; unverified fake-review allegations; no internal funnel data here,Medium (closes a credibility/diligence gap),Low,Marketing / Internal Audit
Instrument the commercial link: overlay conversion/refund/renewal/chargeback time series on the review inflections,Business-impact currently directional only,High (converts scenarios from plausible to evidenced),Low-Medium,Analytics / Finance
